{"event_log_id":"sha256:9de75ac659730fd86fd05591ba1bd3d8d54930725d07332051564d6b43323250","events":[{"deal_ref":"example-verbal-fallback/deal:0","event_index":0,"event_type":"deal_started","match_ref":"example-verbal-fallback","payload":{"deal_number":0,"dealer":3,"forehand":0,"score_before":[0,0]},"ruleset_id":"project_target_v1","schema_version":"tuppi.engine.public_event.v1"},{"deal_ref":"example-verbal-fallback/deal:0","event_index":1,"event_type":"show_accepted","match_ref":"example-verbal-fallback","payload":{"declared_contract":"RAMI","seat":0,"shown_card":"3C","verbal_required":true},"ruleset_id":"project_target_v1","schema_version":"tuppi.engine.public_event.v1"},{"deal_ref":"example-verbal-fallback/deal:0","event_index":2,"event_type":"contract_resolved","match_ref":"example-verbal-fallback","payload":{"contract":"RAMI","declarer":0,"first_leader":3},"ruleset_id":"project_target_v1","schema_version":"tuppi.engine.public_event.v1"},{"deal_ref":"example-verbal-fallback/deal:0","event_index":3,"event_type":"trick_started","match_ref":"example-verbal-fallback","payload":{"leader":3,"trick_index":0},"ruleset_id":"project_target_v1","schema_version":"tuppi.engine.public_event.v1"},{"deal_ref":"example-verbal-fallback/deal:0","event_index":4,"event_type":"card_played","match_ref":"example-verbal-fallback","payload":{"card":"2S","position":0,"seat":3,"trick_index":0},"ruleset_id":"project_target_v1","schema_version":"tuppi.engine.public_event.v1"},{"deal_ref":"example-verbal-fallback/deal:0","event_index":5,"event_type":"card_played","match_ref":"example-verbal-fallback","payload":{"card":"2C","position":1,"seat":0,"trick_index":0},"ruleset_id":"project_target_v1","schema_version":"tuppi.engine.public_event.v1"},{"deal_ref":"example-verbal-fallback/deal:0","event_index":6,"event_type":"card_played","match_ref":"example-verbal-fallback","payload":{"card":"2H","position":2,"seat":1,"trick_index":0},"ruleset_id":"project_target_v1","schema_version":"tuppi.engine.public_event.v1"},{"deal_ref":"example-verbal-fallback/deal:0","event_index":7,"event_type":"card_played","match_ref":"example-verbal-fallback","payload":{"card":"2D","position":3,"seat":2,"trick_index":0},"ruleset_id":"project_target_v1","schema_version":"tuppi.engine.public_event.v1"},{"deal_ref":"example-verbal-fallback/deal:0","event_index":8,"event_type":"trick_completed","match_ref":"example-verbal-fallback","payload":{"team_tricks_after":[0,1],"trick_index":0,"winner":3},"ruleset_id":"project_target_v1","schema_version":"tuppi.engine.public_event.v1"},{"deal_ref":"example-verbal-fallback/deal:0","event_index":9,"event_type":"trick_started","match_ref":"example-verbal-fallback","payload":{"leader":3,"trick_index":1},"ruleset_id":"project_target_v1","schema_version":"tuppi.engine.public_event.v1"},{"deal_ref":"example-verbal-fallback/deal:0","event_index":10,"event_type":"card_played","match_ref":"example-verbal-fallback","payload":{"card":"3S","position":0,"seat":3,"trick_index":1},"ruleset_id":"project_target_v1","schema_version":"tuppi.engine.public_event.v1"},{"deal_ref":"example-verbal-fallback/deal:0","event_index":11,"event_type":"card_played","match_ref":"example-verbal-fallback","payload":{"card":"3C","position":1,"seat":0,"trick_index":1},"ruleset_id":"project_target_v1","schema_version":"tuppi.engine.public_event.v1"},{"deal_ref":"example-verbal-fallback/deal:0","event_index":12,"event_type":"card_played","match_ref":"example-verbal-fallback","payload":{"card":"3H","position":2,"seat":1,"trick_index":1},"ruleset_id":"project_target_v1","schema_version":"tuppi.engine.public_event.v1"},{"deal_ref":"example-verbal-fallback/deal:0","event_index":13,"event_type":"card_played","match_ref":"example-verbal-fallback","payload":{"card":"3D","position":3,"seat":2,"trick_index":1},"ruleset_id":"project_target_v1","schema_version":"tuppi.engine.public_event.v1"},{"deal_ref":"example-verbal-fallback/deal:0","event_index":14,"event_type":"trick_completed","match_ref":"example-verbal-fallback","payload":{"team_tricks_after":[0,2],"trick_index":1,"winner":3},"ruleset_id":"project_target_v1","schema_version":"tuppi.engine.public_event.v1"},{"deal_ref":"example-verbal-fallback/deal:0","event_index":15,"event_type":"trick_started","match_ref":"example-verbal-fallback","payload":{"leader":3,"trick_index":2},"ruleset_id":"project_target_v1","schema_version":"tuppi.engine.public_event.v1"},{"deal_ref":"example-verbal-fallback/deal:0","event_index":16,"event_type":"card_played","match_ref":"example-verbal-fallback","payload":{"card":"4S","position":0,"seat":3,"trick_index":2},"ruleset_id":"project_target_v1","schema_version":"tuppi.engine.public_event.v1"},{"deal_ref":"example-verbal-fallback/deal:0","event_index":17,"event_type":"card_played","match_ref":"example-verbal-fallback","payload":{"card":"4C","position":1,"seat":0,"trick_index":2},"ruleset_id":"project_target_v1","schema_version":"tuppi.engine.public_event.v1"},{"deal_ref":"example-verbal-fallback/deal:0","event_index":18,"event_type":"card_played","match_ref":"example-verbal-fallback","payload":{"card":"4H","position":2,"seat":1,"trick_index":2},"ruleset_id":"project_target_v1","schema_version":"tuppi.engine.public_event.v1"},{"deal_ref":"example-verbal-fallback/deal:0","event_index":19,"event_type":"card_played","match_ref":"example-verbal-fallback","payload":{"card":"4D","position":3,"seat":2,"trick_index":2},"ruleset_id":"project_target_v1","schema_version":"tuppi.engine.public_event.v1"},{"deal_ref":"example-verbal-fallback/deal:0","event_index":20,"event_type":"trick_completed","match_ref":"example-verbal-fallback","payload":{"team_tricks_after":[0,3],"trick_index":2,"winner":3},"ruleset_id":"project_target_v1","schema_version":"tuppi.engine.public_event.v1"},{"deal_ref":"example-verbal-fallback/deal:0","event_index":21,"event_type":"trick_started","match_ref":"example-verbal-fallback","payload":{"leader":3,"trick_index":3},"ruleset_id":"project_target_v1","schema_version":"tuppi.engine.public_event.v1"},{"deal_ref":"example-verbal-fallback/deal:0","event_index":22,"event_type":"card_played","match_ref":"example-verbal-fallback","payload":{"card":"5S","position":0,"seat":3,"trick_index":3},"ruleset_id":"project_target_v1","schema_version":"tuppi.engine.public_event.v1"},{"deal_ref":"example-verbal-fallback/deal:0","event_index":23,"event_type":"card_played","match_ref":"example-verbal-fallback","payload":{"card":"5C","position":1,"seat":0,"trick_index":3},"ruleset_id":"project_target_v1","schema_version":"tuppi.engine.public_event.v1"},{"deal_ref":"example-verbal-fallback/deal:0","event_index":24,"event_type":"card_played","match_ref":"example-verbal-fallback","payload":{"card":"5H","position":2,"seat":1,"trick_index":3},"ruleset_id":"project_target_v1","schema_version":"tuppi.engine.public_event.v1"},{"deal_ref":"example-verbal-fallback/deal:0","event_index":25,"event_type":"card_played","match_ref":"example-verbal-fallback","payload":{"card":"5D","position":3,"seat":2,"trick_index":3},"ruleset_id":"project_target_v1","schema_version":"tuppi.engine.public_event.v1"},{"deal_ref":"example-verbal-fallback/deal:0","event_index":26,"event_type":"trick_completed","match_ref":"example-verbal-fallback","payload":{"team_tricks_after":[0,4],"trick_index":3,"winner":3},"ruleset_id":"project_target_v1","schema_version":"tuppi.engine.public_event.v1"},{"deal_ref":"example-verbal-fallback/deal:0","event_index":27,"event_type":"trick_started","match_ref":"example-verbal-fallback","payload":{"leader":3,"trick_index":4},"ruleset_id":"project_target_v1","schema_version":"tuppi.engine.public_event.v1"},{"deal_ref":"example-verbal-fallback/deal:0","event_index":28,"event_type":"card_played","match_ref":"example-verbal-fallback","payload":{"card":"6S","position":0,"seat":3,"trick_index":4},"ruleset_id":"project_target_v1","schema_version":"tuppi.engine.public_event.v1"},{"deal_ref":"example-verbal-fallback/deal:0","event_index":29,"event_type":"card_played","match_ref":"example-verbal-fallback","payload":{"card":"6C","position":1,"seat":0,"trick_index":4},"ruleset_id":"project_target_v1","schema_version":"tuppi.engine.public_event.v1"},{"deal_ref":"example-verbal-fallback/deal:0","event_index":30,"event_type":"card_played","match_ref":"example-verbal-fallback","payload":{"card":"6H","position":2,"seat":1,"trick_index":4},"ruleset_id":"project_target_v1","schema_version":"tuppi.engine.public_event.v1"},{"deal_ref":"example-verbal-fallback/deal:0","event_index":31,"event_type":"card_played","match_ref":"example-verbal-fallback","payload":{"card":"6D","position":3,"seat":2,"trick_index":4},"ruleset_id":"project_target_v1","schema_version":"tuppi.engine.public_event.v1"},{"deal_ref":"example-verbal-fallback/deal:0","event_index":32,"event_type":"trick_completed","match_ref":"example-verbal-fallback","payload":{"team_tricks_after":[0,5],"trick_index":4,"winner":3},"ruleset_id":"project_target_v1","schema_version":"tuppi.engine.public_event.v1"},{"deal_ref":"example-verbal-fallback/deal:0","event_index":33,"event_type":"trick_started","match_ref":"example-verbal-fallback","payload":{"leader":3,"trick_index":5},"ruleset_id":"project_target_v1","schema_version":"tuppi.engine.public_event.v1"},{"deal_ref":"example-verbal-fallback/deal:0","event_index":34,"event_type":"card_played","match_ref":"example-verbal-fallback","payload":{"card":"7S","position":0,"seat":3,"trick_index":5},"ruleset_id":"project_target_v1","schema_version":"tuppi.engine.public_event.v1"},{"deal_ref":"example-verbal-fallback/deal:0","event_index":35,"event_type":"card_played","match_ref":"example-verbal-fallback","payload":{"card":"7C","position":1,"seat":0,"trick_index":5},"ruleset_id":"project_target_v1","schema_version":"tuppi.engine.public_event.v1"},{"deal_ref":"example-verbal-fallback/deal:0","event_index":36,"event_type":"card_played","match_ref":"example-verbal-fallback","payload":{"card":"7H","position":2,"seat":1,"trick_index":5},"ruleset_id